 ID#;dialog
200001;Well, the Chamber is said to home to something that only the Heir of Slytherin can control. It is said to be the home of a monster.
200001;D'you think it's true? D'you think there really is a Chamber of Secrets?
200001;Yes. Couldn't you tell? McGonagall's worried. All the teachers are.
200001;Well, if there really is a Chamber of Secrets, a-and it really has been opened, then that means---
200001;The Heir of Slytherin has returned to Hogwarts. The question is, who is it?
200001;Let's think. Who do we know who thinks all Muggle-borns are scum?
200001;If you're talking about Malfoy.
200001;Of course. You heard him! 'You'll be next Mudbloods,'
200001;I heard him. But Malfoy, the Heir of Slytherin?
200001;Well, maybe Ron's right, Hermione. I mean, look at his family. The whole lot of them have been in Slytherin for centuries.
200001;Crabbe and Goyle must know. Maybe we could trick them into telling.
200001;Even they aren't that thick. But there might be another way. Mind you, it would be difficult. Not to mention, we would be breaking about fifty school rules. And, it'll be dangerous. Very dangerous.
200001;Here it is. 'The Polyjuice Potion.'  'Properly brewed, the Polyjuice Potion allows the drinker to transform himself temporarily into the physical form of another.'
200001;Do you mean, if Harry and I drink that stuff, we'll turn into Crabbe and Goyle?
200001;Yes.
200001;Wicked! Malfoy'll tell us anything.
200001;Exactly. But it's tricky. I've never seen a more complicated potion.
200001;Well, how long will it take to make?
200001;A month.
200001;A month? But, Hermione, if Malfoy is the Heir of Slytherin, he could attack half the Muggle-borns in the school by then.
200001;I know. But it's the only plan we've got.
200001;Yeah! Come on Slytherin!
200001;Another goal for Slytherin! They lead Gryffindor ninety to thirty!
200001;Yeah! Yeah!
200001;All right there, Scarhead?
200001;Watch yourself, Harry!
200001;Wood! Look out!
200001;Blimey! Harry's got himself a rogue Bludger! That's been tampered with, that has!
200001;I'll stop it.
200001;No! Even with a proper wand it's too risky. You could hit Harry!
200001;Training for the ballet, Potter?
200001;You'll never catch me, Potter!
200001;Let's go.
200001;Harry Potter has caught the Snitch! Gryffindor wins!
200001;Finite incantatem!
200001;Thank you.
200001;Are you okay?
200001;No, I think my- I think my arm's broken.
200001;Not to worry, Harry. I will fix that arm of yours straight away.
200001;No, not you.
200001;Oh, poor boy doesn't know what he's saying. Now, this… won't hurt a bit. Brackium emendo!
200001;Oh! Ooh! Ugh!
200001;Ah, yes, well, ha, that can sometimes happen, um, butuh, the point is, uh,…
200001;Ohh! Uhh!
200001;…you can no longer feel any pain, and, heh- very clearly, the bones are not broken.
200001;Broken? There's no bones left!
200001;Uh-huh-ugh!
200001;Much more flexible, though.
200001;Uhh, uhhh…
200001;Oh, Mr. Malfoy, stop making such a fuss, you can go. Out of my way. Out of my way! Should've been brought straight to me. I can mend bones in a heartbeat- but growing them back…
200001;You will be able to, won't you?
200001;Oh, I'll be able to, certainly. But it'll be painful. You're in for a rough night, Potter. Regrowing bones is a nasty business.
200001;Ugh!
200001;Well, what do you expect? Pumpkin juice?
200001;Uh!
200001;Kill. Kill… Time to kill!
200001;Hello!
200001;Dobby?
200001;Harry Potter should have listened to Dobby! Harry Potter should have gone back home when he missed the train.
200001;It was you… You stopped the barrier from letting Ron and me through.
200001;Indeed. Yes, sir.
200001;You nearly got Ron and me expelled!
200001;At least you would be away from here. Harry Potter must go home! Dobby thought his Bludger would be enough to make Harry Potter see that---
200001;Your Bludger? You made that Bludger chase after me?
200001;Uhuh… Dobby feels most aggrieved, sir. Dobby had to iron his hands.
200001;You'd better clear off before my bones come back, Dobby, or I might strangle you!
200001;Uh-huh-huh… Dobby is used to death threats sir. Dobby gets them five times a day at home.
200001;I don't suppose you could tell me why you're trying to kill me?
200001;Not kill you, sir, never kill you! Dobby remembers how it was before Harry Potter triumphed over He-Who-Must-Not-Be-Named. We house elves were treated like vermin, sir. Of course, Dobby is still treated like vermin…uh, huh, huh, huh! Aah, ahh…
200001;Why do you wear that thing Dobby?
200001;This, sir? It is a mark of the house-elves' enslavement. Dobby can only be freed if his master presents him with clothes. Ah! Listen. Listen! Terrible things are about to happen at Hogwarts. Harry Potter must not stay here, now that history is to repeat itself.
200001;Repeat itself? You mean this has happened before?
200001;Ah! I shouldn't have said that! Oh! Ah! Dah! Bad Dobby! Bad!
200001;Dobby, stop it! Stop it! Stop, Dobby! Tell me, Dobby. When did this happen before? Who's doing it now?
200001;Dobby cannot say, sir. Dobby only wants Harry Potter to be safe.
200001;No, Dobby. Tell me. Who is it?
200001;Put him here. What happened?
200001;There's been another attack.
200001;I think- do ya know- I think he's been Petrified, Madame Pomfrey. Look! Perhaps he managed to take a picture of his attacker…
200001;What can this mean, Albus?
200001;It means…that our students are in great danger.
200001;What should I tell the staff.
200001;The truth. Tell them Hogwarts is no longer safe. It is as we feared, Minerva. The Chamber of Secrets has indeed been opened again.
200001;Again? You mean the Chamber of Secrets has been opened before?
200001;Of course. Don't you see? Lucius Malfoy must have opened it when he was at school here. And now he's taught Draco how to do it.
200001;Maybe. We'll have to wait for the Polyjuice Potion to know for sure.
200001;Enlighten me. Why are we brewing this potion in broad daylight, in the middle of a girl's lavatory? Don't you think we'll get caught?
200001;Heh… No. No one ever comes in here.
200001;Why?
200001;Moaning Myrtle.
200001;Who?
200001;Moaning Myrtle.
200001;Who's Moaning Myrtle?
200001;I'm Moaning Myrtle! I wouldn't expect you to know me! Who would ever talk about ugly, miserable, moping Moaning Myrtle? Huh…aaaah!
200001;She's a little sensitive.
200001;Gather 'round, gather 'round! Can everybody see me? Can you all hear me? Excellent! In light of the dark events of recent weeks, Professor Dumbledore has granted me permission to start this little Dueling Club to train you all up in case you ever need to defend yourselves, as I myself have done on countless occasions- for full details, see my published works. Let me introduce my assistant, Professor Snape. He has sportingly agreed to help me with a short demonstration. Now, I don't want any of you youngsters to worry- you'll still have your Potions master when I'm through with him, never fear. One, two, three.
200001;Expelliarmus!
200001;Whoaah!
200001;Do you think he's all right?
200001;Who cares?
200001;An excellent idea to show them that, Professor Snape, but if you don't mind me saying, it was pretty obvious- ah- what you were about to do. And if I had wanted to stop you, it would have been only too easy.
200001;Perhaps it would be prudent to first teach the students to block unfriendly spells, Professor.
200001;An excellent suggestion, Professor Snape! Ah… Let's have a volunteer pair! Um, Potter, Weasley, how about you?
200001;Weasley's wand causes devastation with the simplest spells. We'll be sending Potter to the hospital wing in a matchbox. Might I suggest someone from my own house? Malfoy, perhaps?
200001;Good luck, Potter.
200001;Thank you, sir.
200001;Wands at the ready.
200001;Scared, Potter?
200001;You wish.
200001;On the count of three, cast your charms to disarm your opponent- only to disarm. We don't want any accidents here. One, two--
200001;Everte statium!
200001;Oh!
200001;Ha, ha, ha, ha, ha!
200001;Rictusempra!
200001;I said disarm only!
200001;Serpensortia!
200001;Don't move, Potter. I'll get rid of it for you.
200001;Allow me, Professor Snape. Alarte ascendare!
200001;Sya- hassa- she. Sya- hasi- heth. Sya- hasi- heth.
200001;Vipera evenesca.
200001;What are you playing at?
200001;You're a Parselmouth? Why didn't you tell us?
200001;I'm a what?
200001;You can talk to snakes.
200001;I know. I mean, I accidentally set a python on my cousin Dudley at the zoo once. Uh, once! But, so what? I bet loads of people here can do it.
200001;No, they can't. It's not a very common gift, Harry. This is bad.
200001;What's bad? If I hadn't told that snake not to attack Justin.
200001;Oh, that's what you said to it!
200001;You were there! You heard me!
200001;I heard you speaking Parseltongue. Snake language?
200001;I spoke a different language? But- I didn't realize I- how can I speak a language without knowing I can?
200001;I don't know, Harry, but it sounded like you were egging the snake on, or something. Harry, listen to me. There's a reason the symbol of Slytherin House is a serpent. Salazar Slytherin was a Parselmouth. He could talk to snakes, too.
200001;Exactly! Now the whole school's gonna think you're his great- greatgreat grandson, or something.
200001;But I'm not… I can't be.
200001;"He lived a thousand years ago; for all we know, you could be."
200001;
200001;I'll see you back in the common room.
200001;Blood…I want blood…They all must die. Kill… Kill… Kill! Time to kill.
200001;Caught in the act! I'll have you out this time, Potter. Mark my words.
200001;No! Mr. Filch! Y-you- you don't understand!
200001;Oh!
200001;Professor… I swear I didn't!
200001;This is out of my hands, Potter.
200001;Professor Dumbledore will be waiting for you. Sherbet lemon.
200001;Professor Dumbledore?
200001;Bee in your bonnet, Potter?
200001;I… I-I was- I was just wondering if you'd put me in the right house.
200001;Yes, you were particularly difficult to place. But, I stand by what I said last year-- you would have done well in Slytherin.
200001;You're wrong.
200001;Umm…
200001;Harry?
200001;Professor! Sir, your bird- there was nothing I could do- he- he just caught fire!
200001;Oh, and about time, too. He's been looking dreadful for days. Pity you had to see him on a burning day. Fawkes is a phoenix, Harry. They burst into flame when it is time for them to die, and then they are reborn from the ashes.
200001;Ah, fascinating creatures, phoenixes. They can carry immensely heavy loads, and their- their tears have healing powers.
200001;Professor Dumbledore, sir! Wait! Listen! Professor Dumbledore, sir, it wasn't Harry!
200001;Hagrid.
200001;In fact, I'd be prepared ter swear it in front o' the Ministry of Magic!
200001;Hagrid! Relax. I do not believe that Harry attacked anyone.
200001;Well, of course you don't, and… Oh… Oh, right. Well, I'll, umhum. I'll just wait outside, then.
200001;Yes.
200001;You don't think it was me, Professor?
200001;No, Harry. I do not think it was you… But I must ask you, is there something you wish to tell me?
200001;No, sir. Nothing.
200001;Very well, then. Off you go.
200001;Everything's set. We just need a bit of who you're changing into.
200001;Crabbe and Goyle.
200001;We also need to make sure that the real Crabbe and Goyle can't burst in on us while we're interrogating Malfoy.
200001;How?
200001;I've got it all worked out. I filled these with a simple Sleeping Draught. Simple, but powerful. Now, once they're asleep hide them in the broomstick cupboard and pull out a few of their hairs, and put on their uniforms.
200001;Whose hair are you ripping out then?
200001;I've already got mine. Millicent Bulstrode– Slytherin- I got this off her robes. I'm going to go check on the Polyjuice Potion. Make sure that Crabbe and Goyle find these.
200001;Ahem…
200001;Ron, maybe I should do it?
200001;Yeah. Right.
200001;Wingardium leviosa. Here they come.
200001;It's good right? Ah… Cool!
200001;Ummm…um.
200001;Ummm…um.
200001;How thick could you get?
200001;Come on. Let's get 'em.
200001;We'll have exactly one hour before we change back into ourselves… Add the hairs.
200001;Ugh- essence of Crabbe.
200001;Cheers!
200001;I think I'm gonna be sick!
200001;Me too.
200001;Ughh!
200001;Uh… Harry?
200001;Ron!
200001;Bloody hell!
200001;We still sound like ourselves. You need to sound more like Crabbe.
200001;Uh… Bloody hell.
200001;Excellent.
200001;But where's Hermione?
200001;I- I don't think I'm going. You go on without me!
200001;Hermione, are you okay?
200001;Just go. You're wasting time!
200001;Come on.
200001;I think the Slytherin common room's this way.
200001;Okay.
200001;Excuse me.
200001;What are you doing d- uh, I mean… What are you doing down here?
200001;I happen to be a school prefect. You, on the other hand, have no business wandering the corridors at this time of night. What are your names again?
200001;Uhh…
200001;I'm…
200001;Crabbe, Goyle! Where have you two been? Pigging out in the Great Hall all this time? Why are you wearing glasses?
200001;Ah- um… Reading.
200001;Reading?
200001;Uh-huh.
200001;I didn't know you could read. And what are you doing down here, Weasley?
200001;Mind your attitude, Malfoy.
200001;Well, sit down. You'd never know the Weasleys were pure-bloods, the way they behave. They're an embarrassment to the wizarding world. All of them. What's wrong with you, Crabbe?
200001;Ahem…Stomachache.
200001;You know, I'm surprised that the Daily Prophet hasn't done a report on all these attacks. I suppose Dumbledore is trying to hush it all up. Father always said Dumbledore was the worst thing that ever happened to this place.
200001;You're wrong!
200001;What? You think there's someone here who's worse than Dumbledore?
200001;Harry Potter?
200001;Good one, Goyle. You're absolutely right. Saint Potter. And people actually think that he's the Heir of Slytherin!
200001;But then you must have some idea who's behind it all.
200001;You know I don't Goyle. I told you yesterday. How many times do I have to tell you? Is this yours? But my father did say this: It's been fifty years since the Chamber was opened. He wouldn't tell me who opened it-- only that they were expelled. The last time the Chamber of Secrets was opened, a Mudblood died. So, it's only a matter of time before one of them is killed this time. As for me, I hope it's Granger. What's the matter with you two? You're acting very…odd.
200001;It's his… stomachache. Calm down.
200001;S- scar.
200001;Hair!
200001;Hey! Where are you going?
200001;That was close!
200001;Hermione, come out. We've got loads to tell you!
200001;Go away!
200001;Ahh! Wait till you see. It's awful! He- ha, ha, he- hee!
200001;Hermione? A- are you OK?
200001;Aaah!
200001;Do you remember me telling you that the Polyjuice Potion was only for human transformations? It was cat's hair I plucked off Millicent Bulstrode's robes. Look at my face.
200001;Hee, ha, ha!
200001;Look at your tail!
200001;Ha, ha, ha!
200001;Have you spoken to Hermione?
200001;She should be out of hospital in a few days, when she stops coughing up fur balls… What's this?
200001;Yuck!
200001;Looks like Moaning Myrtle's flooded the bathroom.
200001;Oooh, oooh, ooooh, huh– huh. Come to throw something else at me?
200001;Why would I throw something at you?
200001;Don't ask me! Here I am, minding my own business, and someone thinks it's funny to throw a book at me.
200001;But, it can't hurt if someone throws something at you. I mean, it'll just go right through you.
200001;Sure! Let's all throw books at Myrtle because she can't feel it! Ten points if you get through her stomach! Fifty points if it goes through her head!
200001;But, who threw it at you, anyway?
200001;I don't know, I didn't see them. I was just sitting in the Ubend thinking about death - aah - and it fell through the top of my head. Uhhuh. Whoo-oooh-whoooo…
200001;'Tom Marvolo Riddle.'
200001;'My name is Harry Potter.'
200001;Hello Harry Potter, my name is Tom Riddle.
200001;'Do you know anything about the Chamber of Secrets?'
200001;Yes.
200001;'Can you tell me?'
200001;No. But I can show you. Let me take you back fifty years ago…
200001;Excuse me. Could you tell me what's going on here? Are you Tom Riddle?
200001;Riddle! Come.
200001;Professor Dumbledore.
200001;Dumbledore?
200001;It is not wise to be wandering around this late hour, Tom.
200001;Yes, Professor. I- I suppose I- I had to see for myself if the rumors were true.
200001;I'm afraid they are, Tom. They are true.
200001;About the school, as well? I don't have a home to go to. They wouldn't really close Hogwarts, would they Professor?
200001;I understand Tom, but I'm afraid Headmaster Dippet may have no choice.
200001;Sir- if it all stopped- if the person responsible was caught--
200001;Is there something you wish to tell me?
200001;No, sir. Nothing.
200001;Very well, then. Off you go.
200001;Good night, sir.
200001;Let's get yeh out of there.
200001;Evening, Hagrid. I'm going to have to turn you in, Hagrid. I don't think you meant it to kill anyone, but--
200001;You can't! You don't understand.
200001;The dead girl's parents will be here tomorrow. The least Hogwarts can do is make sure the thing that killed their daughter is slaughtered.
200001;It wasn't him. Aragog never killed no one! Never!
200001;Monsters don't make good pets, Hagrid. Now, stand aside.
200001;No!
200001;Stand aside, Hagrid!
200001;No!
200001;Cistem aperio! Arania exumai!
200001;Aragog! Aragog!
200001;I can't let you go. They'll have your wand for this, Hagrid. You'll be expelled.
200001;Hagrid! Haagriid!
200001;Woah!
200001;It was Hagrid. Hagrid opened the Chanter of Secrets fifty years ago.
200001;It can't be Hagrid. It just can't be.
200001;We don't even know this Tom Riddle. He sounds like a dirty, rotten snitch to me.
200001;The monster had killed somebody, Ron. What would any of us have done?
200001;Look. Hagrid's our friend. Why don't we just go and ask him about it?
200001;That'll be a cheerful visit! “Hello, Hagrid! Tell us, have you been setting anything mad and hairy loose in the castle lately?”
200001;Mad and hairy? You wouldn't be talking about me now, would ya?
200001;No!
200001;No!
200001;No!
200001;W- what's that you've got, Hagrid?
200001;Oh, It's a- Flesh-Eatin' Slug Repellent. For the Mandrakes, ya know. Now, accordin' to Professor Sprout, they've still got a bit o' growing up to do. But, once their acne's cleared up, we'll be able to chop 'em up and stew 'em, and then we'll get those people down at the hospital un-Petrified. In the meantime, though, you three had best be lookin' after yourselves. All right? Hmm.
200001;Hello, Neville!
200001;Harry- I don't know who did it, but you'd better come! Come on!
200001;It had to be a Gryffindor. Nobody else knows our password- unless it wasn't a student.
200001;Who ever it was, they must have been looking for something.
200001;And they found it. Tom Riddle's diary is gone.
200001;Alright, listen up. We play our game, Hufflepuff doesn't stand a
200001;And not to mention, they're dead scared that Harry'll Petrify them if they fly anywhere near him.
200001;Well, that too. Professor McGonagall.
200001;This match has been cancelled.
200001;We can't cancel Quidditch.
200001;Silence, Wood. You and your teammates will go to Gryffindor Tower, now. Potter, you and I will find Mr. Weasley. There's something the both of you have to see.
200001;I warn you, this could be a wee bit of a shock.
200001;Hermione!
200001;She was found near the Library, along with this. Does it mean anything to either of you?
200001;No.
200001;Could I have your attention please? Because of recent events, these new rules will be put into effect immediately. “All students will return to their house common rooms by six o'clock every evening. All students will be escorted to each lesson by a teacher. No exceptions.” I should tell you this: unless the culprit behind these attacks is caught, it is likely the school will be closed.
200001;We've got to talk to Hagrid, Ron. I can't believe it's him, but if he did set the monster loose last time, he'll know how to get inside the Chamber of Secrets, and that's a start.
200001;But you heard McGonagall! We're not allowed to leave the tower except for class.
200001;I think it's time to get my Dad's old cloak out again.
200001;Who's there? Hello? Hello?
200001;What's that for?
200001;Oh, nothing. I- I was expecting, ah… It doesn't matter- come on inI just made a pot o' tea.
200001;Hagrid, are you okay?
200001;I'm fine! I'm alright.
200001;Did you hear about Hermione?
200001;Oh, yeah. I heard about that, all righ'.
200001;Look, we have to ask you something. Do you know who's opened the Chamber of Secrets?
200001;What you had to understand about that is—  Quick under the cloak. Don't say a word. Be quiet, both o' you… Professor Dumbledore, sir!
200001;Good evening, Hagrid. I wonder, could we…?
200001;Of course! Come in! Come in.
200001;That's Dad's boss! Cornelius Fudge, Minister of Magic!
200001;Bad business, Hagrid. Very bad business. Had to come-- three attacks on Muggle-borns. Things have gone far enough. The Ministry's got to act.
200001;Oh, but I never- you know I never, Professor!
200001;I want it understood, Cornelius, that Hagrid has my full confidence.
200001;Albus look, Hagrid's record is against him. I've got to take him.
200001;Take me? Take me where? Not Azkaban Prison?
200001;I'm afraid we have no choice, Hagrid.
200001;Already here, Fudge? Good…
200001;What're you doin' here? Get outta my house!
200001;Believe me, I take absolutely no pleasure being inside your-- you call this a house? Huh! No. I simply called at the school, and was told the headmaster was here.
200001;Well, what exactly is it that you want with me?
200001;The other governors and I have decided it's time for you to step aside. This is an order of suspension. You'll find all twelve signatures on it. I'm afraid we feel you've rather lost your touch. Well, what, with all these attacks, there'll be no Muggle-borns left at Hogwarts. I can only imagine what an awful loss that would be to the school.
200001;Yeh can' take Professor Dumbledore away. Take him away, an' the Muggle-borns won' stand a chance! You mark my words, there'll be killin's next!
200001;You think so?
200001;Calm yourself, Hagrid. If the governors desire my removal, I will, of course, step aside. However, you will find that help will always be given at Hogwarts to those who ask for it.
200001;Admirable sentiments. Shall we? Fudge!
200001;Come, Hagrid… Well?
200001;Ahem! If, uh, if anybody was looking for some stuff, then all they'd have to do would be to follow the spiders. Yup! That would lead them right! That's all I have to say. Oh, and someone'll need to feed Fang while I'm away.
200001;Good boy.
200001;Hagrid's right! With Dumbledore gone, there'll be an attack a day!
200001;Look! Well, come on. Come on, Fang!
200001;What?!
200001;"You heard what Hagrid said; 'Follow the spiders.'"
200001;They're headed to the Dark Forest! Why spiders! Why couldn't it be “follow the butterflies?”
200001;Harry, I don't like this… Harry, I don't like this at all!
200001;Shush!
200001;Can we go back now?
200001;Come on!
200001;Who is it?
200001;Don't panic.
200001;Hagrid? Is that you?
200001;We're friends of Hagrid's. And you? Y- y-you're Aragog aren't you?
200001;Yes. Hagrid has never sent men into our hollow before.
200001;He's in trouble. Up at the school, there have been attacks. They think it's Hagrid. They think he opened the Chamber of Secrets, like before.
200001;That's a lie! Hagrid never opened the Chamber of Secrets.
200001;Then you're not the monster.
200001;No! The monster was born in the castle. I came to Hagrid from a distant land, in the pocket of a traveler.
200001;Harry.
200001;Shush. But if you're not the monster, then- then what did kill that girl fifty years ago?
200001;We do not speak of it. It is an ancient creature we spiders fear above all others.
200001;But have you seen it?
200001;I never saw any part of the castle but the box in which Hagrid kept me. The girl was discovered in a bathroom. When I was accused, Hagrid brought me here.
200001;Harry!
200001;What?
200001;Ahh- hhh…
200001;Well, thank you. We'll just…go.
200001;Go? I think not. My sons and daughters do not harm Hagrid on my command. But I cannot deny them fresh meat when it wanders so willingly into our midst. Good-bye, friend of Hagrid.
200001;Can we panic now?
200001;Know any spells?
200001;One, but it's not powerful enough for all of them.
200001;Where's Hermione when you need her?
200001;Let's go! Arania exumai! Go!
200001;Whoah!
200001;Whoah!
200001;Glad we're out of there! Ah- Aaaah!
200001;Arania exumai!
200001;Thanks for that.
200001;Don't mention it. Get us out of here. Now! Come on! Come on! Move faster!
200001;Aah!
200001;Aah!
200001;Go on! Go! Get us in the air.
200001;The flying gear's jammed!
200001;Come on! Pull!
200001;I'm trying!
200001;Follow the spiders! Follow the spiders! If Hagrid ever gets out of Azkaban, I'll kill him! I mean, what was the point of sending us in there? What have we found out?
200001;We know one thing. Hagrid never opened the Chamber of Secrets. He was innocent.
200001;Wish you were here Hermione. We need you… now, more than ever.
200001;What's that?
200001;Ron, this is why Hermione was in the Library the day she was attacked. Come on!
