ID#;dialog
800001;It's beautiful here.
800002;It was our Aunt's. We used to come here as kids. The Order uses it now as a safe house -- what's left of us, at least.
800003;Muggles think these keep evil away. But they're wrong...
800004;I need to talk to the goblin.
800005;How are you?
800006;Alive.
800007;You probably don't remember --
800008;Yes.
800009;And brought me here.
800010;You are a very unusual wizard.
800011;Why did you leave Gringotts?
800012;Soon the Death Eaters will control it. That was unacceptable to me.
800013;Then you're on our side.
800014;This is a wizard's war. I take no side.
800015;It is impossible.
800016;Alone, yes. With you, no.
800017;How did you come by this sword?
800018;It's complicated. Why did Bellatrix Lestrange think it should be in her vault at Gringotts?
800019;It's complicated.
800020;The sword presented itself to us in a moment of need. We didn't steal it.
800021;There is a sword in Madam Lestrange's vault identical to this one, but it is a fake. It was placed there this past summer.
800022;And she never suspected?
800023;The replica is very convincing. Only a goblin would recognize that this is the true Sword of Gryffindor.
800024;Who put it there? The fake.
800025;It was not my place to ask, nor did I desire to. There are more than a few curious things in the vaults at Gringotts.
800026;And in Madam Lestrange's vault as well?
800027;Perhaps.
800028;I have no interest in gold.
800029;Then what? The goblin twists the curl at his chin... then his eyes
800030;That is my price.
800031;I have your word, Harry Potter, that you will give me the Sword of Gryffindor if I help you?
800032;Harry, are you thinking there's a Horcrux in Bellatrix's vault?
800033;She was terrified when she thought we'd been in there. She kept asking you what else we'd taken. I'd bet anything there's a Horcrux there. If we find it, we can kill it. And if we kill it, we're one step closer to killing him.
800034;And if we find one? How're we supposed to destroy it if we've given Griphook the sword?
800035;I'm still working on that part.
800036;He's too weak.
800037;Forgive me if I don't get up.
800038;Mr. Ollivander, I need to ask you a few questions.
800039;Anything, m'boy, anything.
800040;Can you identify these, sir?
800041;Walnut and dragon heartstring. Twelve and three quarter inches. Unyielding. This belongs to Bellatrix Lestrange.
800042;And this?
800043;Hawthorn. Unicorn hair. Ten inches. Reasonably pliant. This was the wand of Draco Malfoy.
800044;Was? Isn't it still?
800045;Perhaps not -- if you won it from him. I sense its allegiance has changed.
800046;The wand chooses the wizard, Mr. Potter. That much has always been clear to those of us who have studied wandlore.
800047;What do you know about the Deathly Hallows, sir?
800048;There are rumored to be three: The Elder Wand, the Resurrection Stone and the Invisibility Cloak. It is said that to possess them all is to make oneself the Master of Death. But few truly believe such objects exist --
800049;But you, sir? Do you believe they exist?
800050;You're lying. You know one exists and you told him about it. You told him about the Elder Wand and where to go looking for it.
800051;He tortured me! Besides, I conveyed only rumors. There's no guarantee he will find it --
800052;He has found it, sir.
800053;That's all, sir. We'll leave you to get some rest now.
800054;He's after you, Mr. Potter. If it's true, what you say, that he has the Elder Wand, I'm afraid you really don't stand a chance.
800055;Then I guess I'll just have to kill him before he finds me, sir.
800056;You're sure it's hers?
800057;Positive. Harry turns to the two wands on the table -- the ones he showed Ollivander -- and extends the longest to Hermione.
800058;I reckon you should take this then.
800059;You heard Ollivander. It's Harry's now.
800060;But I hate that thing -- that's the wand that killed Sirius! How can I hold it and not feel...
800061;If I can hold it, you can.
800062;How will we know what it is when we get in there? After all, a Horcrux can be anything.
800063;I'll know. I can't explain. It's like...
800064;That's a bit scary.
800065;It is, Harry. Did Dumbledore ever say anything to you, something that might explain why --
800066;No. I just know. When one's near.
800067;This is the closest I could find to what you described, Hermione.
800068;It's perfect. Thank you, Fleur.
800069;You're leaving, aren't you.
800070;In the morning.
800071;And Griphook?
800072;He'll be leaving too.
800073;Listen, I don't know what you're up to, but I know goblins. If you've struck any kind of bargain with Griphook, you must be exceptionally careful to live up to it. If you don't... he won't be forgiving.
800074;The sky has lost a star.
800075;My father used to say that when a child died. She looks up, smiles.
800076;Yeah. Funny. Listen, Luna, about your father, I don't want you to think I --
800077;I know you understand why my father did what he did, Harry. That's why we don't need to talk about it.
800078;Hogwarts?
800079;It's not the place you left, you
800080;Neither am I.
800081;Always good value. I'll miss her.
800082;What d'you think?
800083;Wouldn't know you if I didn't know you.
800084;You want to tell me what that is?
800085;Sirius gave it to me. He had a matching piece. He said if I ever needed him, all I had to do was look into it.
800086;You mean he could see you?
800087;Something like that. I don't know. He died before I ever got to use it. The thing is...
800088;Go on.
800089;You'll think I'm mental, but more than once, when I've looked into it -- I think I've seen Dumbledore.
800090;Bloody hell... that's a sight.
800091;Well, how do I look?
800092;Hideous.
800093;Oh dear, I missed a spot, didn't I? Hold still...
800094;Couldn't do anything about that bit in the back that's always flipping up, could you? Dead annoying --
800095;Never mind. I'm good.  That is you in there, isn't it?
800096;You can give that to Hermione to hold, all right, Griphook?
800097;Madam Lestrange.
800098;Good morning? Good morning? You're Bellatrix Lestrange, not some dewy-eyed schoolgirl!
800099;Hey. Easy.
800100;She gives us away and we might as well use that sword to slit our own throats. Understand?
800101;He's right. I was being stupid.
800102;C'mon. Let's do it.
800103;Identification.
800104;I wish to enter my vault.
800105;I see. Very well. Excuse me, won't you?
800106;I don't like to be kept waiting.
800107;Next.
800108;He's with me.
800109;They know!
800110;What do you mean?
800111;They know she's an imposter! They've been warned!
800112;Madam Lestrange. Would you mind presenting your wand?
800113;And why should I do that?
800114;Harry, what do we do? Harry...?
800115;It's the bank's policy. I'm sure you understand, given the current climate --
800116;No, I most certainly do not understand --
800117;I'm afraid I must insist.
800118;Imperio.
800119;Very well, Madam Lestrange. If you will follow me.
800120;But... Bogrod, there have been special instructions regarding the Lestrange vault.
800121;I'm fully aware of that. I'm also aware the Lestranges are one of our oldest and most respected families.
800122;Yes, sir, but our instructions are very specific --
800123;Let me be specific with you, Ricbert. I've run this bank for forty-five years, long before anyone had even heard of a Death Eater. The day may come that they feel they can run this place better than me, but that day has not yet arrived. Am I understood!
800124;Madam, if you will, I will escort you myself.
800125;How long before they come after us?
800126;What's that? Up ahead.
800127;I should have known --
800128;What is that, Griphook?
800129;Griphook! What is that!
800130;Well done. Hey.
800131;The Thief's Downfall. Washes away all enchantments. Can be deadly.
800132;You don't say.  Just out of interest... is there any other way out of here?
800133;No.
800134;What the devil are you all doing down here!
800135;We need him!
800136;Is this your doing, Griphook? You have no rights here anymore. When you gave up your keys, you --
800137;Imperio!
800138;Well done.
800139;No. It's not possible...
800140;Bloody hell. That's a Welsh Green.
800141;It looks like it's been down here forever.
800142;Go on.
800143;It's been trained to expect pain when it hears the noise.
800144;That's barbaric. I...
800145;We'll only have a few seconds. In other words... they'll be no do-
800146;Ready, Bogrod?
800147;Hm? Oh. Yes. Of course.
800148;Lumos !
800149;Lumos !
800150;Lumos !
800151;Blimey...
800152;Look.
800153;No wonder Bellatrix thought it was real.
800154;Is it here, Harry? Can you feel anything?
800155;It's hot! All eyes turn to the bowl, WOBBLING MADLY on the floor, when... it SPLITS APART and begins to MULTIPLY.
800156;Ron, your foot!
800157;We'll be crushed! Hurry!
800158;That's it. Up there.
800159;How're we going to reach it?
800160;Give me the sword! The real one.
800161;Keep going!
800162;Harry! Behind you!
800163;The cup!
800164;In here!
800165;We have a deal, Griphook.
800166;I said I'd get you in. I never said anything about getting you out.
800167;Griphook! Griphook!
800168;Thieves! Help! Thieves!
800169;Foul little git. Least we've got Bogrod.
800170;That's unfortunate.
800171;We can't just stand here! Who's got an idea?
800172;You're asking us? You're the brilliant one.
800173;I've got something. But it's mad.
800174;Relashio!
800175;That's your idea?
800176;Come on!
800177;It doesn't realize it's free!
800178;That was brilliant! BRILLIANT!
800179;Bloody hell.
800180;We're dropping!
800181;I say we jump!
800182;When?
800183;The boy has discovered our secret, Nagini. We must find out just how much he knows. We must return to our hiding places and see if the others are safe.
800184;He knows.
800185;How is it you --
800186;I saw him.
800187;You let him in! Harry, you can't --
800188;I can't always help it, Hermione!
800189;Never mind! What did you see?
800190;He's angry. But he's scared too. He's going to make sure the other Horcruxes are safe.
800191;What happens when he finds out four are gone?
800192;I reckon he'll do anything to stop us from finding the rest. There's more: one of them's at Hogwarts.
800193;What?
800194;What?
800195;You saw it?
800196;Tonight? But we have to plan. We have to figure out what --
800197;Honestly, Hermione, when have any of our plans actually worked? We plan, we get there and all hell breaks loose.
800198;'Fraid he's right. One problem: Snape's Headmaster now. We can't just walk in the front door.
800199;We'll go to Hogsmeade. To Honeydukes. Take the secret passage in the cellar.
800200;There's something wrong with him. In the past, I could always follow his thoughts. Now everything feels disconnected.
800201;Maybe it's because of the Horcruxes. Maybe he's growing weaker. Maybe he's dying.
800202;No. It's more like he's wounded. If anything, he feels more
800203;They were ready for us.
800204;We know you're here, Potter. There's no getting away.
800205;Perhaps you need some convincing.
800206;What's he mean by that?
800207;No, you'll give us away.
800208;Expecto Patronum!
800209;In here, Potter.
800210;Did you get a look at him! Fora second I thought it was --
800211;I know.
800212;Harry! I can see you! In here!
800213;You bloody fools! What were you thinking coming here? Do you have any idea how dangerous it is --
800214;You're Aberforth.
800215;Dumbledore's brother. It's you I've been seeing -- here. It's
800216;Where've you left him?
800217;He's dead.
800218;Sorry to hear it. I liked that elf.
800219;Mundungus Fletcher, 'bout a year ago.
800220;Dung had no right selling you that. It belonged to --
800221;Sirius. Albus told me. He also told me that you'd likely be hacked off if you ever found out I had it. But ask yourself where you'd be if I didn't.
800222;Right then. Reckon you're hungry. Let's get you fed, then think of the best way to get you out of here.
800223;Do you hear much from the others? From the Order?
800224;The Order is finished. You-Know- Who's won. Anyone who says otherwise is kidding themselves.
800225;We need to get into Hogwarts. Dumbledore gave us a job to do.
800226;Did he now? Nice job? Easy?
800227;We've been hunting Horcruxes. We think the last one's in the school. But we'll need your help getting in.
800228;If we can find it and kill it, then we kill him, and then we can end this war once and for all. We need to get into Hogwarts tonight.
800229;It's not a job my brother's given you, it's a suicide mission. Do yourself a favor boy. Go home. Live a little longer.
800230;Dumbledore trusted me, to see this through.
800231;Why should he...
800232;Keep secrets? You tell me.
800233;I only care about the Dumbledore I knew. I trusted him.
800234;Did you now? And why is that?
800235;I had no reason not to —-
800236;That's a boy's answer. A boy who goes chasing Horcruxes on the word of a man who won't even tell him where to start. You're lying. Not just to me, which doesn't matter, but to yourself as well. That's what a fool does.
800237;You're drunk.
800238;You don't strike me as a fool, Mr. Potter. So I'll ask you again. There must be a reason. Why do you trust anything my brother ever said to you? Why?
800239;You know what to do...
800240;Where've you sent her?
800241;You'll see soon enough.
800242;That's Ariana, isn't it? Your sister. She's beautiful.
800243;She'll always be beautiful.
800244;She died very young, didn't she.
800245;My brother sacrificed many things, Mr. Potter, in his journey to find power, including her. She was devoted to him -- he gave her everything, but time.
800246;Mr. Dumbledore... thank you.
800247;Did save our lives twice. Kept an eye on us in that mirror. That doesn't seem like someone who's given up, does it?
800248;She's coming back! And she's got someone with her!
800249;Who's that with her? Bloody hell...
800250;I knew you'd come! I told them alii! Harry Potter would never abandon Hogwarts!
800251;Neville, you look...
800252;Like hell? I reckon. This is nothing. Seamus is worse. You'll see. Hermione! Ron!
800253;Hey, Ab. There might be a couple more people on the way.
800254;Well? Ready?
800255;I don't remember this being on the Marauder's Map.
800256;That's because it never existed till now. The seven secret passages were sealed off before the start of the year. This is the only way in or out now. The grounds are crawling with Death Eaters and Dementors.
800257;How bad is it, Neville? With Snape as Headmaster.
800258;Hardly ever see him. It's the Carrows you have to watch out for.
800259;The Carrows?
800260;Brother and sister. They're in charge of discipline. Like punishment, the Carrows.
800261;They did that to you? But why?
800262;Today's Dark Arts lesson had us practicing the Cruciatus Curse. On First Years. I refused. Hogwarts has changed.
800263;Aw, c'mon. Don't be grim. We're all used to it by now. And the thing is, it helps when people stand up, gives everyone hope. I used to notice that when you did it, Harry. C'mon, we're almost there.
800264;Let's have a bit of fun, shall we?  Hey! Listen up, you lot! I've brought you a surprise!
800265;Blimey.
800266;Get the word out to Remus and the others that Harry's back.
800267;River, DA calling. Do you read? We have a new weather report: Lightning has struck. I repeat, lightning has struck...
800268;Okay, okay! Stand down! lLet's not kill them before You-Know-Who gets the chance!
800269;Okay. There's something we need to find, something hidden here in the castle. It could help us defeat You-Know-Who.
800270;What is it?
800271;We don't know.
800272;Where is it?
800273;I realize it's not much to go on.
800274;That's nothing to go on.
800275;I think it might have something to do with Ravenclaw. It would be small, easy to conceal, valuable. Any ideas?
800276;Well, there's Rowena Ravenclaw's lost diadem.
800277;The lost diadem of Ravenclaw? Hasn't anyone ever heard of it? It's quite famous.
800278;Yes, but Luna, it's lost. For centuries now. There's not a person alive today who's seen it.
800279;Excuse me. But would someone tell me: what's a bloody diadem?
800280;It's a kind of crown. You know, like a tiara.
800281;Ravenclaw's was rumored to have magical properties, to enhance the wisdom of the wearer.
800282;Harry.
800283;Hey there. Ron smiles, about to speak, then notices Ginny's eyes have not left Harry. He frowns, speaks to Hermione.
800284;Six months she hasn't seen me and it's like I'm Frankie First Year. I mean, I'm only her brother.
800285;Got loads of those, though, doesn't she? There's only one Harry.
800286;Shut up, Seamus.
800287;What is it, Ginny?
800288;Snape knows. He knows that Harry was spotted in Hogsmeade.
800289;Put a smile on, Miss Reynolds. Wouldn't want me to have to pay a visit to Daddy again, would you?
800290;Many of you are surely wondering why I have summoned you here at this hour. It has come to my attention that earlier this evening... Harry Potter was sighted in Hogsmeade.
800291;I mention this in the hopes that truth will not be supplanted by
800292;For myself and a few select members of the staff this comes as little surprise. We have, for some time, considered Mr. Potter's return to Hogwarts to be not only possible but inevitable. Consequently, in the past several months and under my specific direction, exhaustive defensive strategies have been employed to defeat any attempt Mr. Potter might make to breach these walls. But know this. Should anyone -- student or staff -- attempt to aid Mr. Potter, that person will be punished in a manner consistent with the severity of their transgression. Rest assured: So long as I am Headmaster at Hogwarts, Harry Potter will never again step foot in this castle.
800293;Now then. If anyone here has knowledge of Mr. Potter's movements this evening... I invite them to step forward now.
800294;I think I can help you out with that... -.. Harry appears.
800295;And I'm afraid it's rather extensive.
800296;How dare you stand where he stood.
800297;Tell them how it was that night. Tell then how you looked him in the eye, a man who trusted you... and killed him. Tell them!
800298;I'm a Gryffindor.
800299;I know that many of you will want to fight. Some of you may even think this wise. But this is foily.
800300;I wish you no harm. TI have great respect for the students of Hogwarts. I was once one myself after all. I ask for but one thing and if granted no magical blood shail be spiit...
800301;Give me Harry Potter. Do this and none shall be harmed. Give me Harry Potter and I shail leave Hogwarts untouched. Give me Harry Potter and you will be rewarded.
800302;But he's there! Potter's there! Someone grab him!
800303;Students out of bed! Students in the corridors!
800304;Oh. Sorry, mum.
800305;Right away.
800306;Time. As much as you can give me.
800307;Is that possible, Professor?
800308;I think you're right.
800309;You, too, Professor.
800310;Let me get this straight, Professor. You're giving us permission to do this?
800311;To blow it up. Boom.
800312;Wicked.
800313;I can bring 'er down.
800314;You realize, of course, that nothing we do will be able to keep out You-Know-Who indefinitely.
800315;That doesn't mean we can't hold him up.
800316;Protego Maxima... Finato Duri... Repello Inimicum...
800317;Harry, Hermione and I have been thinking. It doesn't really matter if we find the Horcrux.
800318;Unless we can destroy it.
800319;So we were thinking --
800320;You were thinking. It's Ron's idea. And it's brilliant.
800321;You destroyed Tom Riddle's Diary with a Basilisk fang, right? Well, we know where we might find one, don't we?
800322;Okay. But take this. That way you can find me when you get back.
800323;Where are you going?
800324;Ravenclaw Common Room. Got to start somewhere. Hermione nods, slips the Map in her beaded bag and she and Ron head off. Just before they turn the corner, Ron looks back, holds Harry's glance briefly... and then is
800325;Harry! Wait! I need to talk to
800326;I'm a bit preoccupied right now, Luna.
800327;We'll talk later, Luna.
800328;Harry --
800329;Later.
800330;Don't you remember what Cho said about Rowena Ravenclaw's diadem: 'There's not a person alive who's seen it.'
800331;It's obvious, isn't it? We have to talk to someone who's dead.
800332;He's very impressive, isn't he?
800333;They never learn. Such a pity.
800334;Begin.
800335;But, my Lord, shouldn't we wait --
800336;Nice night for it!
800337;Okay, Luna. Who've you got in mind?
800338;That's it. I want a charge on each and every joist.
800339;You do know what you're doing, don't you, Seamus?
800340;Blimey.
800341;Not good.
800342;If you're to find her, you'll find her down there.
800343;No. I think it best if you two talk alone. She's very shy.
800344;Tell Professor McGonagall Remus and I will handle this side of the castle.
800345;Yes, sir.
800346;Dean!
800347;It's the quality of one's conviction that determines success, not the number of one's followers.
800348;Who said that?
800349;Me.
800350;Speaking of quality.
800351;You shouldn't have. It's Teddy who needs you.
800352;He'll sleep 'til dawn and snore like his father. It's you who needs me tonight.
800353;It's you...
800354;Ha! dal
800355;Yeah! You and whose army!
800356;Woah! Easy up there!
800357;Sorry.
800358;Harry talks in his sleep. Haven't you noticed?
800359;No. Of course not.
800360;I've never got this far before.
800361;I'm scared.
800362;Me too. Hermione: I didn't expect it to be like this.
800363;Not this.
800364;You're the Grey Lady, the ghost of Ravenclaw Tower.
800365;I do not answer to that name.
800366;I'm sorry. It's Helena, isn't it? Helena Ravenclaw. Rowena's daughter. Luna told me.
800367;Are you a friend of Luna's?
800368;Yes. She thought you might be able to help me.
800369;You seek my mother's diadem.
800370;Yes! That's right --
800371;Luna is kind. Unlike so many of the others, but she was wrong. I cannot help you.
800372;Wait! Please!
800373;Many have sought my mother's diadem. Its powers are
800374;But I don't care about its powers! Honestly --
800375;I don't seek it for myself! You have to believe me!
800376;I want to destroy it.
800377;That's what you want, isn't it, Helena? You want it destroyed.
800378;But I only wanted to be more like her, clever and wise. She wore it so beautifully, but on me... I grew to hate it... the pain I felt... the pain I feel even now...
800379;I'll end your pain, Helena. Tell me where it is and I'll destroy it, I swear, on my mother's memory —-
800380;Another swore to destroy it, many years ago, a strange boy with a strange name...
800381;Tom Riddle --
800382;But he lied.
800383;He's lied to many people --
800384;I know what he's done! I know who he is! He defiled it! With Dark Magic!
800385;Strange... you remind me of him a bit...
800386;It's here. In the castle. In the
800387;If you have to ask, you'll never know. If you know, you need only ask...
800388;Thank you... -.. then turning...
800389;Thank you... -.. then running.
800390;You do it.
800391;Yes, you can.
800392;Not good.
800393;Ready!?
800394;Are you bloody joking?!
800395;He's good...
800396;He's good...
800397;What?
800398;That was kind of exciting. Seamus grins and winks knowingly. Ginny shakes her head.
800399;Mad. The both of you.
800400;Not good.
800401;Night-tee night.
800402;You let us out of here, you filthy squib!
800403;Ginny! Neville! You alright?
800404;Never better! Feel like I could spit fire! Haven't seen Luna, have you?
800405;Luna -- ?
800406;I'm mad for her! Think it's about time I told her, seeing as there's a pretty good chance we'll both be dead by dawn!
800407;I know.
800408;Bloody hell. We/'ll never find him on this.
800409;There he is.
800410;Brilliant.
800411;He vanished. Just now. I saw it. Ron glances at MAP -- then:
800412;That's right. I did.
800413;Let's go.
800414;Brilliant.
800415;Take my hand.
800416;Well, well, what brings you here, Potter? Harry looks slowly over his shoulder. Draco -- Blaise and Goyle at his side -- steps INTO VIEW, his face bisected by light. He holds a wand on Harry.
800417;I could ask you the same.
800418;I virtually lived here last year. Remember?
800419;I remember.
800420;What's wrong with the one you have?
800421;Easy.
800422;Why didn't you tell her?
800423;Bellatrix. You knew it was me. But you didn't say anything.
800424;Give me my wand.
800425;No. I don't think so...
800426;Besides, its allegiance is to me now. If you want it, you'll have to win it back. Perhaps even kill me...
800427;C'mon, Draco. Don't be a prat.
800428;Avada Kedavra!
800429;Expelliarmus!
800430;Did you see where it went? The diadem!
800431;Well done. Let's find Ron and get out of here.
800432;RUN! Goyle's set the bioody place on fire!
800433;Split up!
800434;Do we climb!
800435;No, it''ll just follow us!
800436;Here! Take one!
800437;Serves him right.
800438;C'mon! This way!
800439;Wait! What about Malfoy and Blaise!
800440;Brilliant.
800441;Nagini. Come.
800442;You're bloody well welcome!
800443;Ron, you once asked me if I thought he felt it -- Voldemort -- when we destroy a Horcrux, when we destroy a piece of his soul.
800444;He does.
800445;It's the snake. She's the last one. The last Horcrux.
800446;Where will he take her?
800447;Someplace safe.
800448;No. He'll keep her close.
800449;Look inside him, Harry.
800450;Find out where he is. If we find him, we find the snake. Then we're one step closer to ending this.
800451;Stop looking at her. She smells your fear. It agitates her. Be grateful she's just eaten.
