ID#;dialog
800452;Forgive me, my Lord, but wouldn't it be more prudent to call off this battle and seek the boy yourself?
800453;I do not need to seek the boy! Before the night is out, he will come to me! Do you understand!
800454;Of c-course, my Lord.
800455;How do you live with yourself, Lucius?  Go. Find Severus. Tell him I need to see him immediately.
800456;I know where he is.
800457;There's more to me than incense and tea leaves, Mr. Finnegan.
800458;Thanks.
800459;Don't mention it.
800460;Why doesn't it work for me?
800461;You have performed extraordinary magic with this wand, my Lord. In the last few hours alone --
800462;No! I am extraordinary! But the wand resists me!
800463;There is no wand more powerful. Ollivander himself said it. Tonight, when the boy comes to you, it will not fail you, I am sure. It answers to you and you only.
800464;Does it?
800465;My Lord?
800466;The wand. Does it truly answer to me?
800467;You're a clever man, Severus. Surely you must know.
800468;Where, Severus? Where does its loyalty lie?
800469;With you, of course, my Lord.
800470;The Elder Wand cannot serve me properly, Severus, because I am
800471;The Elder Wand belongs to the wizard who killed its last owner. Ollivander was quite explicit about that. You killed Dumbledore, Severus. While you live, the Elder Wand cannot be truly mine.
800472;My Lord --
800473;You have been a good and faithful servant, Severus.
800474;But only I can live forever...
800475;Kill.
800476;Nagini! Come!
800477;Take them...
800478;Take them!
800479;Please.
800480;Give me something! Quickly! A flask! Anything.
800481;They are the same...
800482;You have your mother's eyes...
800483;He's gone. The snake too.
800484;You have fought valiantly... but in vain. I do not wish this. Every drop of magical bliood
800485;I therefore command my forces to retreat. In their absence, dispose of your dead with dignity. Treat your injured.
800486;Never! Do you hear me! NEVER!
800487;Where is everyone?
800488;Lily... Then...
800489;Lily! Come out of there! Now!
800490;We're going home.
800491;She's jealous. Because she's ordinary and you're special.
800492;That's mean.
800493;It's true. You know so yourself.
800494;No! Don't kill me!
800495;That wasn't my intention.
800496;Stand up, Severus. I haven't much time. What message do you bring from Lord Voldemort this time?
800497;Is this about the Prophecy?
800498;Yes.
800499;How much did you relay?
800500;Only what I heard. But now... he thinks it refers to her.
800501;The Prophecy did not refer to a woman. It spoke of a boy born at the end of July --
800502;Yes! But he thinks it's her son! He intends to hunt them down now! To kill them!
800503;If she means so much to you, surely Lord Voldemort would spare her in exchange for the boy.
800504;I have asked.
800505;You disgust me. You would sacrifice the life of an innocent child over a schoolboy crush?
800506;She's more than that! She's different! Beautiful. Kind.
800507;And should I do so, what will you give me in return, Severus?
800508;Anything.
800509;You said you would keep her safe!
800510;Lily and James put their faith in the wrong person. Rather like you, Severus.
800511;The boy survives.
800512;He has her eyes.
800513;He doesn't need protection. The Dark Lord has gone --
800514;The Dark Lord will return. And the boy will be in terrible danger when he does.
800515;No one can know. Your word.
800516;My word that I shall never reveal the best of you, Severus? If you insist.
800517;He exhibits no measurable talent. His arrogance rivals even his father's. And he seems to relish his fame.
800518;Sometimes we see what we expect to see, Severus. Other teachers indicate the boy is modest, likeable and while no prodigy, possesses above-average gifts. Personally, I find him rather engaging.
800519;You see what you want to see.
800520;Perhaps. oOh. Severus.
800521;Why did you put it on? Surely you realized it carried a curse.
800522;I was... foolish... greedy...
800523;Drink the rest. It will contain the curse to the hand for the time being.
800524;For the time being?
800525;It will spread.
800526;How long?
800527;Maybe a year.
800528;Well, this makes matters much more straightforward.
800529;Do not ignore me, Severus. Was it not you who told me of Lord Voldemort's plan to have the Malfoy boy murder me?
800530;It is not expected that he will succeed.
800531;You must agree.
800532;Yes. You must be the one to kill me, Severus. It is the only way. Only then will the Dark Lord trust you completely.
800533;You ask too much.
800534;There will come a time when Harry Potter must be told something. But you must wait until Voldemort is at his most vulnerable.
800535;Tell him what?
800536;On the night Lord Voldemort went to Godric's Hollow to kill Harry, and Lily Potter cast herself between them, the curse rebounded. When that happened, a part of Lord Voldemort's soul latched itself onto the only living thing it could find: Harry himself.
800537;There's a reason Harry can speak with snakes. There's a reason he can look into Lord Voldemort's mind. A part of Lord Voldemort lives inside him.
800538;So when the time comes, the boy must die.
800539;You've kept him alive so that he can die at the proper moment. You've been raising him like a pig for slaughter.
800540;But this is touching, Severus. Don't tell me you've grown to care for the boy?
800541;Expecto Patronum!
800542;Lily. After all this time?
800543;Always... We GO TO BLACK...
800544;The irony of course, Severus, is that -- in the end -- you and the boy desire the same thing...
800545;Where've you been?
800546;We thought you'd gone to the forest, we thought you might be --
800547;I'm going there now.
800548;Are you mad! No!
800549;It's... meant to be.
800550;Rubbish! You can't just give yourself up to him -- Hermione squeezes Ron's arm, silencing him.
800551;What is it, Harry? What is it you
800552;There's a reason I can... hear them -- the Horcruxes.
800553;I think I've known for awhile.
800554;I'll go with you. I/'ll --
800555;Kill the snake. Kill the snake and then it's just him. Then it will be over.
800556;I'll take him from here.
800557;It's all right. We're going to get you inside.
800558;I kept calling. No one came.
800559;Don't worry. I won't leave you. I promise.
800560;You've been so brave, sweetheart.
800561;Why are you here? All of you?
800562;We never left, dear.
800563;Does it hurt? Dying?
800564;Quicker than falling asleep.
800565;And he will want it to be quick.
800566;You're nearly there, son.
800567;I'm sorry. I didn't want any of you to die for me. And Remus, your son...
800568;Others will tell him what his mother and father died for. Someday he'll understand...
800569;You'll stay with me?
800570;Until the end.
800571;He won't be able to see you?
800572;No. We're here, you see.
800573;Stay close to me.
800574;Always...
800575;No sign of him, my Lord.
800576;I thought he would come. I was, it seems... mistaken.
800577;You weren't.
800578;Quiet!
800579;Harry Potter. The Boy Who Lived. Come to die. Nagini HISSES behind her protective guard of Death Eaters. Harry's gaze shifts to her when Voldemort raises
800580;You cannot help.
800581;Harry. You wonderful boy. You brave, brave man. Let us walk.
800582;Sir, this, is this... I mean, forgive me, but you are dead, aren't you, sir?
800583;Oh, yes.
800584;Then... I'm dead too?
800585;Not?
800586;Not.
800587;But I didn't defend myself. I let him kill me.
800588;It's true, isn't it, sir? A bit of him lives in me, doesn't it?
800589;Did. It was just destroyed only moments ago by none other than Voldemort himself.
800590;"You were the seventh Horcrux, Harry; the Horcrux he never meant to make."
800591;And you knew this? That's why you were certain I wouldn't die?
800592;Certain? No. Little is certain in this world, Harry. Call it an educated guess.
800593;Professor, is that -- ?
800594;Exactly where are we, sir?
800595;I was going to ask you that. Where would you say that we are?
800596;It looks like King's Cross station -- only a lot cleaner. And without the trains.
800597;King's Cross! Is that right? Well, this is, as they say, your party.
800598;Sir, why didn't you just tell me about the Deathly Hallows?
800599;You will have to forgive me, Harry. You see... I didn't trust
800600;I feared that you would make the same mistake I made, that you would be intoxicated by the power the Hallows promise their possessor. But I crave your pardon, Harry. It's clear to me now, as it should have been all along, that you are the better man.
800601;Sir --
800602;You are the worthy possessor of the Hallows, Harry, not me. I was fit to own the Elder Wand, because I took it not for gain, but to save others from it. But I took the Stone because I longed to recall someone who has long been at peace and for that I paid with my life.
800603;You wanted to see Ariana again, didn't you, sir?
800604;Yes.
800605;I used the Stone as well, sir, only a little while ago when I entered the Forest. I saw my mum and dad, and Sirius and Lupin...
800606;True. But ask yourself this: were you calling them? Or were they calling you?
800607;I've got to go back, haven't I?
800608;That is up to you.
800609;I've got a choice?
800610;Oh yes. We are in King's Cross, you say? I think, should you so decide, you would be able to, let's say, board a train.
800611;And where would it take me?
800612;On.
800613;Voldemort's got the Elder Wand.
800614;True.
800615;And the snake lives.
800616;Yes.
800617;And I've nothing to kill it with.
800618;'Help will always be given at Hogwarts to those who ask for it.'
800619;I have always prized my ability to turn a phrase -- words are, in my
800620;With all due respect, sir, I think what we need here is a miracle.
800621;I've never put much stock in miracles, Harry. On the other hand, I can attest wholly to the extensive advantages of a related phenomenon.
800622;Which would be, sir?
800623;Luck.
800624;Do not pity the dead, Harry. Pity the living and, above all, those who live without love.
800625;Sir, my mother's Patronus. It was a doe, wasn't it? Just like Professor Snape's. Curious, don't you think?
800626;Actually, if I think about it... it doesn't seem curious at all.
800627;Professor.
800628;Is this real? Or has this been happening inside my head?
800629;Of course it is happening inside your head, Harry. But why should that mean that it is not real?
800630;My lord, let me help you --
800631;I do not require assistance.
800632;The boy. Is he dead?
800633;Is he alive? Draco?
800634;Don't despair, Longbottom. I put you in Gryffindor for good reason...
800635;Who's that?
800636;... Hagrid's carrying?
800637;Neville, who is that?
800638;What's going on here, Neville?
800639;Behold, Nagini. Our work is done.
800640;No... NO!
800641;Stupid girl. You cry for that?
800642;While your hands ran dark with the blood of mothers and sons, fathers and daughters, brothers and sisters, his were clasped in prayer -- but it was a prayer for one and one only. While you battled courageously, until you could no longer will yourself to stand, he had long since fallen to his knees. While you cursed me until your voices grew ragged, he begged me for mercy in a voice as meek as a child's.
800643;So do not cry for that. He's not worthy of your tears. And do not despair of his betrayal. You were never in his heart. Not for one single solitary beat.
800644;Liar!
800645;Did you not hear me! Harry Potter is dead! From this day forward, you put your faith in me or suffer the consequences. HARRY POTTER Is
800646;Now is the time to declare yourself.
800647;Draco...
800648;Draco, don't be stupid --
800649;Come, Draco.
800650;He saved your life.
800651;Well done, Draco. Who will be next? Hm? Come now, don't be shy.
800652;Well, I must say, I'd hoped for better. Is this truly the best Hogwarts has to offer?
800653;Who might you be, young man?
800654;Neville Longbottom.
800655;Well, welcome, Neville. I'm sure we can find a place for you in our ranks.
800656;Someone has to do the washing.
800657;Now, now, Bellatrix. Let's not underestimate our young friend. By stepping forward, he lives to see another day...
800658;I'd like to say something.
800659;Very well, Neville. I'm sure we'd all be fascinated to hear what you have to say.
800660;It doesn't matter that Harry is gone. A troubled MURMUR ripples through the crowd.
800661;This isn't over.
800662;Potter! Harry turns. Draco's hand whips forward and -- to Harry's shock -- tosses him his wand. Ron GRINS.
800663;Well done, Malfoy!
800664;Confringo!
800665;The snake! We've got to kill the snake!
800666;Harry! Look out!
800667;Nagini! With me!
800668;Leave her!
800669;I said LEAVE HER!
800670;Nagini
800671;Die! Die
800672;Why do you live!
800673;Because I have something worth living for.
800674;Confringo!
800675;Come on, granny, give us your best.
800676;Back off, boys! She's mine!  You will never touch my chiidren again!
800677;Be thankful we only took one. Besides...
800678;Hermione!
800679;Yes!
800680;I don't want you to say anything you wouldn't say if we weren't about to be killed by a giant snake! It'll just ruin it!
800681;You were right.
800682;When you told Professor Snape it was failing you. It will always fail you.
800683;It belongs to me! I killed Snape!
800684;Together.
800685;What's the matter with her?
800686;There's more to me than incense and tea leaves, Mr. Finnegan.
800687;I told you: it's useless to you.
800688;Not exactly leaving the place better than we found it, are we?
800689;Can't make an omelette without breaking a few eggs.
800690;Something my mum used to say.
800691;Why didn't it work for him? The Elder wand.
800692;Because it answers to another.
800693;When he killed Snape, he thought the wand would become his. But the thing is... it never belonged to Snape.
800694;But that means...
800695;It answers to me.
800696;What do you reckon we should do with it?
800697;We?
800698;Well, it wasn't boring, was it?
800699;Together?
800700;Don't forget to give Professor Longbottom our best.
800701;Will there really be thestrals pulling the carriages?
800702;There's nothing scary about thestrals. They're gentle things. Anyway, you won't be going up to school in the carriages. You/'be going in the boats, remember?
800703;Dad?
800704;Yes?
800705;What if I'm put in Slytherin?
800706;Albus Severus Potter. You were named after two Headmasters of Hogwarts. One of them was a Slytherin. And he was probably the bravest man I ever knew.
800707;But just say I am --
800708;Then Slytherin House will have gained a wonderful wizard. But listen, if it means so much to you, you can choose Gryffindor. The Sorting Hat takes your choice into account.
800709;Really?
800710;Really.
800711;Ready?
800712;Ready.
